Title,Subhead,Article URL,Premium,Byline,Article Type,Image URL
"En Chine, la razzia sur le Labubu électrise l’industrie du jouet",,,Premium,,,
Le mariage de Jeff Bezos à Venise provoque des vagues sur la lagune,,,Premium,,,
Quand le juge qualifie un chien de « meuble »,,,Premium,Rafaële Rivais,,
"Patrick Artus : « Aux Etats-Unis, les attaques sur le système de recherche publique et les universités compromettent les perspectives de croissance  »",,,Premium,Patrick Artus Conseiller économique d’Ossiam et membre du Cercle des économistes,,
L’allocution de Donald Trump sur l’Iran en intégralité,,,,,,
Israël-Iran : plus de 3 000 blessés dans des frappes israéliennes en Iran depuis le début de la guerre,,,,,,
"En Iran, la réaction du ministre des affaires étrangères, Abbas Araghtchi, aux frappes américaines : « Les Etats-Unis ne comprennent que le langage de la menace et de la force »",,,,,,
Ukraine : ce que l’on sait de l’attaque de drones inédite lancée contre des bases russes,,,,,,
Le Moyen-Orient soumis à la primauté de la force,,,,,,
"Theodor Meron, juriste : « Les pires atrocités ont souvent produit les avancées les plus significatives en droit international humanitaire »",,,Premium,,,
"Loïs Boisson, le rôle modèle qui manquait au sport féminin en France ?",,,Premium,,,
"Bernard Hourcade, géographe : « La guerre pourrait provoquer le réveil du nationalisme et du patriotisme des Iraniens »",,,Premium,Bernard Hourcade Directeur de recherche émérite au CNRS,,
"A la Cinémathèque française, la bouillonnante école de l’animation japonaise, en vingt-cinq classiques",,,Premium,,,
"« Personne sur cette terre », de Victor del Arbol : tuer, un mal nécessaire",,,Premium,,,
"« Jack Lang, le beau rôle », sur France 5 : ministre, maire, député, directeur… huit décennies d’une existence dense, commentées par l’intéressé",,,Premium,,,
"Derrière le bruit des guitares, les mots du politique à la Fête de la musique",,,Premium,,,
"Une balade à Fontenay-sous-Bois, de l’écoparc des Carrières à la Halle Roublot",,,Premium,,,
Est-ce bien raisonnable de… porter un slip de bain à la plage ?,,,,Marc Beaugé Magazine,,
"Que faire, que voir, où aller ? L’agenda culturel et art de vivre en France à partir du 23 juin",,,,,,
« Les applications de rencontre ont tout intérêt à réduire notre vie sentimentale à des ratés sans lendemain »,,,Premium,,,
"Le grand écart de Donald Trump, entre frappes en Iran et promesses de paix","Le président américain assure avoir agi « pour arrêter la guerre » en ordonnant le bombardement de trois sites nucléaires, alors qu’une majorité des Américains, dont une partie de son camp, sont hostiles à un nouveau conflit.",https://www.lemonde.fr/international/article/2025/06/23/le-grand-ecart-de-donald-trump-entre-frappes-en-iran-et-promesses-de-paix_6615386_3210.html,Premium,,,https://img.lemde.fr/2025/06/21/0/0/3873/2582/600/400/75/0/ab435b5_ftp-import-images-1-lf7r8oogewoc-2025-06-21t222024z-1866024770-rc297fax9p8b-rtrmadp-3-usa-trump.JPG
"« Pourquoi n’y aurait-il pas un changement de régime à Téhéran ? », s’interroge Donald Trump après les frappes américaines",,https://www.lemonde.fr/international/live/2025/06/23/en-direct-iran-israel-pourquoi-n-y-aurait-il-pas-un-changement-de-regime-a-teheran-s-interroge-donald-trump-apres-les-frappes-americaines_6614739_3210.html,,,,https://img.lemde.fr/2025/06/22/1/0/5000/3333/114/76/95/0/75676b3_ftp-import-images-1-vzyx33fizbwa-2025-06-22t025844z-890000860-rc2e7faf9rt3-rtrmadp-3-iran-nuclear.JPG
"En Israël, Benyamin Nétanyahou conforté par la guerre avec l’Iran et les frappes américaines",,https://www.lemonde.fr/international/article/2025/06/23/en-israel-benyamin-netanyahou-conforte-par-la-guerre-avec-l-iran-et-les-frappes-americaines_6615391_3210.html,Premium,,,https://img.lemde.fr/2025/06/23/1319/1182/3296/2197/114/76/95/0/caf42bc_upload-1-3soyvxol1nxp-lgeai-tel-aviv-22juinpm-11.jpg
L’Iran a-t-il encore les capacités militaires de contrer la pression américano-israélienne ?,,https://www.lemonde.fr/international/article/2025/06/23/l-iran-a-t-il-encore-les-capacites-militaires-de-contrer-la-pression-americano-israelienne_6615394_3210.html,Premium,,,https://img.lemde.fr/2025/06/22/0/0/8640/5760/114/76/95/0/da0d66c_ftp-import-images-1-dox6vpoxdhst-6f74a73be1d2469c8f803291f1f78ae6-0-e29dcc8edc6446df966e96956507087e.jpg
"L’opération américaine en Iran décrite, étape par étape, par le Pentagone",,https://www.lemonde.fr/international/article/2025/06/22/attaque-en-iran-l-operation-americaine-decrite-etape-par-etape-par-le-pentagone_6615299_3210.html,Premium,,,
"Bertrand Badie, politiste : « Pour Trump, l’important reste de montrer que tous les chemins, la paix comme la guerre, passent par Washington »",,https://www.lemonde.fr/idees/article/2025/06/22/bertrand-badie-politiste-pour-trump-l-important-reste-de-montrer-que-tous-les-chemins-la-paix-comme-la-guerre-passent-par-washington_6615308_3232.html,Premium,,,
"A Tel-Aviv, après la riposte de l’Iran, l’attente et l’espoir d’un coup fatal porté à la menace nucléaire",,https://www.lemonde.fr/international/article/2025/06/22/a-tel-aviv-apres-la-riposte-iranienne-l-attente-et-l-espoir-d-un-coup-fatal-porte-face-a-la-menace-nucleaire_6615295_3210.html,Premium,,,
Guerre en Ukraine : une attaque de drones et de missiles russes sur Kiev fait au moins cinq morts et une vingtaine de blessés,Quatre personnes ont notamment été tuées alors qu’une partie d’un immeuble résidentiel a été détruite dans l’ouest de la capitale ukrainienne.,https://www.lemonde.fr/international/live/2025/06/23/en-direct-guerre-en-ukraine-une-attaque-massive-de-drones-russes-sur-kiev-fait-un-mort-et-au-moins-neuf-blesses_6615228_3210.html,,,,https://img.lemde.fr/2025/06/23/0/41/1978/1319/398/265/75/0/b91ed50_ftp-import-images-1-eg5axzmsye4r-2025-06-23t032223z-1852565050-rc2z7fa4ii2c-rtrmadp-3-ukraine-crisis-attack-kyiv.JPG
Affaire Edouard Philippe : la plaignante demande la désignation d’un juge d’instruction,"A l’origine d’une enquête préliminaire visant le maire du Havre et une de ses adjointes depuis 2023, une haut-fonctionnaire a déposé, le 20 juin, une plainte avec constitution de partie civile pour « prise illégale d’intérêts », « harcèlement moral », « favoritisme », « détournement de fonds publics » et « concussion ».",https://www.lemonde.fr/societe/article/2025/06/23/affaire-edouard-philippe-la-plaignante-demande-la-designation-d-un-juge-d-instruction_6615393_3224.html,Premium,,,https://img.lemde.fr/2025/06/21/0/1/5268/3512/398/265/75/0/0b39781_upload-1-6hyqteqhm96r-000-47ny6y3.jpg
"NBA : l’habile reconstruction de l’Oklahoma City Thunder, champion pour la première fois","Portée par le MVP Shai Gilgeous-Alexander, la jeune franchise a renversé les Indiana Pacers lors de l’ultime match d’une finale relevée. Un sacre qui vient valider le projet de son patron, Sam Presti, en poste depuis 2008.",https://www.lemonde.fr/sport/article/2025/06/23/nba-l-habile-reconstruction-de-l-oklahoma-city-thunder-champion-pour-la-premiere-fois_6615385_3242.html,Premium,,,https://img.lemde.fr/2025/06/23/0/0/3546/2364/398/265/75/0/513703d_upload-1-y9z1tk29owyf-063-2221581037.jpg
Le mariage de Jeff Bezos à Venise provoque des vagues sur la lagune,"Les habitants de la cité des Doges ont constitué un collectif pour s’opposer aux noces du fondateur d’Amazon avec la journaliste Lauren Sanchez, qui ont prévu une cérémonie en grande pompe qui devrait se tenir entre le jeudi 26 et le samedi 28 juin.",https://www.lemonde.fr/economie/article/2025/06/23/le-mariage-de-jeff-bezos-a-venise-provoque-des-vagues-sur-la-lagune_6615349_3234.html,Premium,,,https://img.lemde.fr/2025/06/13/0/0/5617/3745/664/442/75/0/8951e9c_ftp-import-images-1-xvm5f2ji3gas-2025-06-13t193011z-1732646313-rc2v1faij1lu-rtrmadp-3-people-bezos-wedding-venice.JPG
"Capucine, 27 ans, analyste en fusions-acquisitions, 5 300 euros par mois : « On regardait les salaires et on se disait qu’on allait vivre comme des rois »",,https://www.lemonde.fr/campus/article/2025/06/23/capucine-27-ans-analyste-en-fusions-acquisitions-5-300-euros-par-mois-on-regardait-les-salaires-et-on-se-disait-qu-on-allait-vivre-comme-des-rois_6615388_4401467.html,Premium,,,https://img.lemde.fr/2025/04/22/0/0/4252/2834/198/132/95/0/e4a92fe_sirius-fs-upload-1-kbioygknrnix-1745313397141-colo-fille.jpg
Pourquoi les festivals de musique sont-ils de plus en plus chers ?,,https://www.lemonde.fr/les-decodeurs/article/2025/06/22/pourquoi-les-festivals-de-musique-sont-ils-de-plus-en-plus-chers_6615227_4355770.html,Premium,,,https://img.lemde.fr/2023/06/15/0/3/4284/2856/198/132/95/0/02190b3_5551453-01-06.jpg
"Fête de la musique : après les appels à « piquer des femmes » sur les réseaux, plus d’une centaine de cas relevés",,https://www.lemonde.fr/societe/article/2025/06/22/fete-de-la-musique-apres-les-appels-a-piquer-des-femmes-sur-les-reseaux-plus-d-une-centaine-de-cas-releves_6615313_3224.html,Premium,,,https://img.lemde.fr/2025/06/22/0/0/5857/3905/198/132/95/0/e7b8a9d_upload-1-xxqalnqbordj-000-63ac7av-1.jpg
Un jeune de 17 ans mis en examen pour des projets d’attentats au nom de l’organisation Etat islamique,,https://www.lemonde.fr/societe/article/2025/06/22/un-jeune-de-17-ans-arrete-pour-des-projets-d-attentats-au-nom-de-l-organisation-etat-islamique_6615309_3224.html,,,,https://img.lemde.fr/2024/10/24/0/0/2250/1500/198/132/95/0/f2bd53d_1729771575341-frame-144.jpg
Drogue : huit ans de prison pour un important trafiquant français recruteur d’une « mule » en chaise roulante,,https://www.lemonde.fr/societe/article/2025/06/22/drogue-huit-ans-de-prison-pour-un-important-trafiquant-francais-recruteur-d-une-mule-en-chaise-roulante_6615315_3224.html,Premium,,,
"Sur Reddit, le succès des forums sur la santé mentale : « C’est comme un groupe de parole, mais sur Internet »",,https://www.lemonde.fr/pixels/article/2025/06/22/sur-reddit-le-succes-des-forums-sur-la-sante-mentale-c-est-comme-un-groupe-de-parole-mais-sur-internet_6615311_4408996.html,Premium,,,
"En Syrie, un attentat-suicide contre une église de Damas fait au moins vingt-deux morts",,https://www.lemonde.fr/international/article/2025/06/22/en-syrie-la-television-d-etat-fait-etat-d-un-attentat-suicide-contre-une-eglise-de-damas_6615307_3210.html,,,,
"« Personne sur cette terre », de Victor del Arbol : tuer, un mal nécessaire",,https://www.lemonde.fr/livres/article/2025/06/22/personne-sur-cette-terre-de-victor-del-arbol-tuer-un-mal-necessaire_6615316_3260.html,Premium,,,
"Canicule : vigilance orange maintenue en Isère et dans le Rhône, Météo-France alerte sur de très fortes chaleurs dans l’Est",,https://www.lemonde.fr/planete/article/2025/06/22/canicule-vigilance-orange-maintenue-en-isere-et-dans-le-rhone-meteo-france-alerte-sur-de-tres-fortes-chaleurs-dans-l-est_6615287_3244.html,,,,
"Les brèves critiques du « Monde des livres » : Jean-Noël Pancrazi, Ali Smith, auteurs du « Monde »…",,https://www.lemonde.fr/critique-litteraire/article/2025/06/22/les-breves-critiques-du-monde-des-livres-jean-noel-pancrazi-ali-smith-auteurs-du-monde_6615312_5473203.html,Premium,,,
"Dans le Vaucluse, deux personnes tuées, dont la mariée, et trois blessés graves, après des tirs à la fin d’un mariage",,https://www.lemonde.fr/societe/article/2025/06/22/mariage-dans-le-vaucluse-deux-personnes-tuees-dont-la-mariee-et-trois-blesses-graves-apres-des-tirs_6615277_3224.html,,,,
Les Etats-Unis attaquent l’Iran et font basculer la guerre au Moyen-Orient dans une incertitude totale,"Après avoir fait mine d’hésiter, Donald Trump a pris un risque historique en décidant, sans autorisation du Congrès, de bombarder trois sites nucléaires iraniens. Tandis que les yeux se tournent vers la République islamique, Israël tient une occasion inédite de mettre à terre le régime de Téhéran, qui a juré sa perte.",https://www.lemonde.fr/international/article/2025/06/22/les-etats-unis-attaquent-l-iran-et-font-basculer-la-guerre-au-moyen-orient-dans-une-incertitude-totale_6615266_3210.html,Premium,,,https://img.lemde.fr/2025/06/22/0/0/3000/2000/664/442/75/0/9e10c4e_ftp-import-images-1-emcfuwsq2xwl-2025-06-22t022729z-2098487010-rc2e7fabctk4-rtrmadp-3-iran-nuclear.JPG
"Le texte du discours de Donald Trump après les frappes américaines : « L’Iran, le tyran du Moyen-Orient, doit maintenant faire la paix »","Le président américain a annoncé, samedi, que les Etats-Unis avaient frappé les trois principaux sites nucléaires iraniens. « Le Monde » publie et traduit sa prise de parole.",https://www.lemonde.fr/international/article/2025/06/22/le-texte-du-discours-de-donald-trump-l-iran-le-tyran-du-moyen-orient-doit-maintenant-faire-la-paix_6615268_3210.html,Premium,,,https://img.lemde.fr/2025/06/22/1057/0/4329/2886/664/442/75/0/f1c5e81_ftp-import-images-1-ulpc79tzywg8-2025-06-22t025845z-915047871-rc2e7fay34a9-rtrmadp-3-iran-nuclear.JPG
Attaque d’Israël contre l’Iran : les ressorts de l’opération « Rising Lion »,"Grâce notamment à l’efficacité de son aviation, l’Etat hébreu a réussi à neutraliser le système de défense antiaérien de la République islamique avant de viser son arsenal balistique et son programme nucléaire.",https://www.lemonde.fr/international/article/2025/06/22/attaque-d-israel-contre-l-iran-les-ressorts-de-l-operation-rising-lion_6615272_3210.html,Premium,,,https://img.lemde.fr/2025/06/21/0/386/1156/771/664/442/75/0/1dd79a8_upload-1-2wxwl3o14ypq-inter-2525-risinglionv3.png
"Theodor Meron, juriste : « Les pires atrocités ont souvent produit les avancées les plus significatives en droit international humanitaire »",,https://www.lemonde.fr/international/article/2025/06/21/theodor-meron-juriste-les-pires-atrocites-ont-souvent-produit-les-avancees-les-plus-significatives-en-droit-international-humanitaire_6615042_3210.html,Premium,"Stéphanie Le Bars Oxford (Royaume-Uni), envoyée spéciale",,
"« La colère est devenue, de Trump à Le Pen, une arme puissante pour l’extrême droite »",,https://www.lemonde.fr/idees/article/2025/06/22/la-colere-est-devenue-de-trump-a-le-pen-une-arme-puissante-pour-l-extreme-droite_6615212_3232.html,Premium,Philippe Bernard Editorialiste au « Monde »,,https://img.lemde.fr/2021/10/04/0/0/0/0/100/100/60/0/a649d65_1633340428935-image-d-ios.jpg
"Les idées d’extrême droite, un poison lent dans l’Union européenne",,https://www.lemonde.fr/idees/article/2025/06/20/les-idees-d-extreme-droite-un-poison-lent-dans-l-union-europeenne_6614761_3232.html,Premium,"Virginie Malingre Bruxelles, bureau européen",,
