Title,Subhead,Article URL,Premium,Byline,Article Type,Image URL
Ben & Jerry’s : l’un des cofondateurs de la célèbre marque américaine de crèmes glacées quitte l’entreprise en raison de désaccords sur les « valeurs »,,,,,,
"D’OpenAI à Google, pourquoi les géants de l’IA lancent leurs propres puces",,,Premium,,,
« La période actuelle traversée par le Danemark fait penser à la mésaventure de la Finlande avec Nokia dans les années 2000 »,,,Premium,Olivier Pinaud,,
"« Pour l’Amérique de Trump, l’annonce d’un pic de la demande de pétrole en 2030 est une trahison »",,,Premium,"Jean-Baptiste Fressoz historien, chercheur au CNRS",,
Comment la dette s’est creusée depuis l’arrivée d’Emmanuel Macron au pouvoir,,,Premium,,,
Ce qu’il faut retenir de la passation des pouvoirs entre François Bayrou et Sébastien Lecornu,,,,,,
« Bloquons tout » : les premières images des actions de mobilisation du 10 septembre,,,,,,
Hiroshima : comment s’est déroulé le bombardement atomique le plus dévastateur de l’histoire,,,Premium,,,
"Après l’assassinat de Charlie Kirk, les Etats-Unis embourbés dans la violence politique",,,,,,
"La tapisserie de Bayeux, œuvre presque millénaire et baromètre des passions franco-britanniques",,,Premium,,,
"La « coalition », cet art subtil des négociations et du compromis que la France peine à maîtriser",,,Premium,,,
"« Pour l’Amérique de Trump, l’annonce d’un pic de la demande de pétrole en 2030 est une trahison »",,,Premium,"Jean-Baptiste Fressoz historien, chercheur au CNRS",,
"Sous la caméra ludique de Vera Chytilova, des vies de femmes passées à la moulinette",,,Premium,,,
"Europe : la vie sans les Etats-Unis, mode d’emploi",,,Premium,,,
"« Katrina. L’ouragan infernal », sur Netflix : vingt ans après, Spike Lee prend le pouls de La Nouvelle-Orléans",,,Premium,,,
"« Oui », grand film enfiévré de Nadav Lapid sur l’apocalypse née du 7-Octobre",,,Premium,,,
Des vignes en toute sobriété : « Je souhaitais montrer que le raisin peut avoir d’autres vocations que la fermentation alcoolique »,,,Premium,,,
"La broche, bête de mode",,,,,,
Simple comme le design shaker,,,,,,
"Les Labubu, ces figurines en peluche devenues un phénomène de mode en France : « C’est moche, mais, comme c’est mignon, les gens achètent quand même »",,,Premium,,,
"Journée intersyndicale du 18 septembre : le défi de la remobilisation, deux ans après l’échec du mouvement contre la réforme des retraites","Les responsables syndicaux interrogés par « Le Monde » témoignent des traces laissées chez les salariés par la réforme des retraites de 2023, adoptée grâce au 49.3, malgré quatorze journées de mobilisation.",https://www.lemonde.fr/economie/article/2025/09/17/journee-intersyndicale-du-18-septembre-le-defi-de-la-remobilisation-deux-ans-apres-l-echec-du-mouvement-contre-la-reforme-des-retraites_6641551_3234.html,Premium,,,https://img.lemde.fr/2025/09/16/1193/0/3667/2444/400/266/75/0/c784aca_upload-1-1dxqef0vxamt-ad005-retraites2-05732.jpg
"Delphine Ernotte, présidente de France Télévisions : « La galaxie médiatique de Vincent Bolloré veut la peau de l’audiovisuel public »",,https://www.lemonde.fr/economie/article/2025/09/18/delphine-ernotte-presidente-de-france-televisions-la-galaxie-mediatique-de-vincent-bollore-veut-la-peau-de-l-audiovisuel-public_6641605_3234.html,Premium,,,https://img.lemde.fr/2025/09/17/998/0/3992/2661/398/265/75/0/4580bd3_upload-1-rgcq5dle5jif-csharrock-delphineernotte-7.jpg
"L’animateur Jimmy Kimmel privé d’antenne aux Etats-Unis par ABC, après des propos sur l’assassinat de Charlie Kirk",,https://www.lemonde.fr/international/article/2025/09/18/l-animateur-jimmy-kimmel-prive-d-antenne-par-abc-apres-des-propos-sur-l-assassinat-de-charlie-kirk_6641597_3210.html,,,,https://img.lemde.fr/2025/09/17/0/176/7170/4780/398/265/75/0/f34eda5_ftp-import-images-1-xtv20atbbbo6-5919877-01-06.jpg
"Après sa rencontre avec Sébastien Lecornu, le Parti socialiste maintient ses menaces de censure","Le premier ministre, qui poursuit ses consultations en vue de former un gouvernement, a reçu la gauche – hors LFI qui avait décliné l’invitation – et l’extrême droite, mercredi. Les socialistes considèrent n’avoir « rien » obtenu à ce stade.",https://www.lemonde.fr/politique/article/2025/09/18/apres-sa-rencontre-avec-sebastien-lecornu-le-parti-socialiste-maintient-ses-menaces-de-censure_6641607_823448.html,Premium,,,https://img.lemde.fr/2025/09/18/0/0/6000/4000/398/265/75/0/df942bb_upload-1-mfb2hwry4ri6-cbi1277007.jpg
"Pour lutter contre les ingérences étrangères, la France crée un fichier des « activités d’influence »","A partir d’octobre, les personnes ou entités exerçant ce type d’occupation sous la houlette d’un acteur extérieur à l’Union européenne devront s’enregistrer auprès de la Haute Autorité pour la transparence de la vie publique.",https://www.lemonde.fr/international/article/2025/09/18/pour-lutter-contre-les-ingerences-etrangeres-la-france-cree-un-fichier-des-activites-d-influence_6641604_3210.html,Premium,,,https://img.lemde.fr/2025/09/18/0/0/5760/3840/398/265/75/0/1a6c28a_upload-1-ydb6u9op32fe-maxnewsfrfour555985.jpg
"Chikungunya : forte hausse des cas autochtones en métropole, Santé publique France appelle à la vigilance face aux moustiques tigres","L’implantation du moustique tigre dans 81 départements métropolitains inquiète les autorités, qui redoutent une propagation accrue du chikungunya et d’autres maladies vectorielles cet automne.",https://www.lemonde.fr/planete/article/2025/09/17/chikungunya-forte-hausse-des-cas-autochtones-en-metropole-sante-publique-france-appelle-a-la-vigilance-face-aux-moustiques-tigres_6641594_3244.html,,,,https://img.lemde.fr/2025/09/17/0/0/4800/3200/398/265/75/0/9e9430a_upload-1-13211ehlicwc-maxnewsspecialtwo260855.jpg
"Au procès de Frédéric Péchier, la détermination d’une lanceuse d’alerte","Une anesthésiste a raconté, mercredi, l’arrêt cardiaque dont avait été mystérieusement victime une de ses patientes en 2017. Un événement qui a fait naître ses doutes sur son confrère, et entraîné les accusations d’empoisonnements multiples, dont douze mortels, pour lesquels le Dr Péchier comparaît devant la cour d’assises du Doubs.",https://www.lemonde.fr/societe/article/2025/09/18/au-proces-de-frederic-pechier-la-determination-d-une-lanceuse-d-alerte_6641602_3224.html,Premium,,,https://img.lemde.fr/2025/09/13/0/0/3441/2294/664/442/75/0/4f53e49_ftp-import-images-1-c0s0phqapyva-5871537-01-06.jpg
"Donald Trump désigne le mouvement « Antifa » comme organisation « terroriste », une semaine après l’assassinat de Charlie Kirk",,https://www.lemonde.fr/international/article/2025/09/18/donald-trump-designe-le-mouvement-antifa-comme-organisation-terroriste-une-semaine-apres-l-assassinat-de-charlie-kirk_6641600_3210.html,,,,https://img.lemde.fr/2025/09/17/1/0/1424/949/198/132/95/0/c76f824_ftp-import-images-1-bs7zy3lcrjdl-01249574766142de9fbba6bfd73cba5d-0-c720244a491e49de9192ac76ec1ea5c2.jpg
"PSG-Atalanta : en Ligue des Champions, Paris continue d’appliquer, avec succès, la recette Luis Enrique",,https://www.lemonde.fr/football/article/2025/09/18/psg-atalanta-en-ligue-des-champions-paris-continue-d-appliquer-avec-succes-la-recette-luis-enrique_6641598_1616938.html,Premium,,,https://img.lemde.fr/2025/09/17/0/0/5553/3702/198/132/95/0/d63e052_ftp-import-images-1-ew0sb9zah2m0-5919665-01-06.jpg
"La Belgique découvre son « abbé Pierre », face sombre comprise",,https://www.lemonde.fr/international/article/2025/09/18/la-belgique-decouvre-son-abbe-pierre-face-sombre-comprise_6641601_3210.html,Premium,,,https://img.lemde.fr/2025/09/17/0/266/2511/1674/198/132/95/0/b89b0b0_upload-1-rsdsifqu5j7z-capture-da-ei-cran-2025-09-18-ai-00-57-57.png
Le pape Léon XIV exclut toute réforme doctrinale sur les femmes et les fidèles LGBT+,,https://www.lemonde.fr/religions/article/2025/09/18/le-pape-leon-xiv-exclut-toute-reforme-doctrinale-sur-les-femmes-et-les-fideles-lgbt_6641599_1653130.html,,,,https://img.lemde.fr/2025/05/08/0/0/2293/1528/198/132/95/0/590f511_ftp-import-images-1-2gfvlezsjde0-d8ef910643e24c36b0e07019a12dd80d-0-5deab3f3421942549f8c49b4098e51df.jpg
L’armée ukrainienne signale de nombreux groupes de drones d’attaque russes dans différentes zones de l’Ukraine,,https://www.lemonde.fr/international/live/2025/09/17/en-direct-guerre-en-ukraine-l-armee-ukrainienne-signale-de-nombreux-groupes-de-drones-d-attaque-russes-dans-differentes-zones-du-pays_6641122_3210.html,,,,
"Aux Etats-Unis, la Fed baisse ses taux pour relancer l’économie",,https://www.lemonde.fr/economie/article/2025/09/17/aux-etats-unis-la-fed-baisse-ses-taux-pour-relancer-l-economie_6641592_3234.html,Premium,,,
Gaza : l’un des principaux chefs du Hamas est apparu sur la chaîne qatarie Al-Jazira après l’attaque israélienne sur Doha,,https://www.lemonde.fr/international/live/2025/09/17/en-direct-gaza-l-un-des-principaux-chefs-du-hamas-est-apparu-sur-la-chaine-qatarie-al-jazira-apres-l-attaque-israelienne-sur-doha_6640485_3210.html,,,,
"Notre sélection de livres cette semaine : « Nos soirées », « Passagères de nuit », « Le Jardinier et la mort »…",,https://www.lemonde.fr/culture/article/2025/09/18/notre-selection-de-livres-cette-semaine-nos-soirees-passageres-de-nuit-le-jardinier-et-la-mort_6641596_3246.html,Premium,,,
"« Oui », grand film enfiévré de Nadav Lapid sur l’apocalypse née du 7-Octobre",,https://www.lemonde.fr/culture/article/2025/09/17/oui-grand-film-enfievre-de-nadav-lapid-sur-l-apocalypse-nee-du-7-octobre_6641528_3246.html,Premium,,,
Gaza : Bruxelles propose de suspendre les avantages commerciaux d’Israël,,https://www.lemonde.fr/international/article/2025/09/17/gaza-bruxelles-propose-de-suspendre-les-avantages-commerciaux-d-israel_6641579_3210.html,Premium,,,
Loi Duplomb : les députés valident l’examen de la pétition contre le texte à l’Assemblée,,https://www.lemonde.fr/politique/article/2025/09/17/loi-duplomb-les-deputes-valident-l-examen-de-la-petition-contre-le-texte-a-l-assemblee_6641580_823448.html,Premium,,,
"En Libye, la Turquie exerce une influence croissante",,https://www.lemonde.fr/afrique/article/2025/09/17/en-libye-la-turquie-exerce-une-influence-croissante_6641552_3212.html,Premium,,,
"La pétition de Philippe de Villiers sur l’immigration, une initiative du groupe Bolloré qui embarrasse le RN et LR","L’extrême droite observe à distance le succès de cette charge contre l’immigration, lancée par les équipes du « JDD ». La pétition demandant un référendum revendique plus d’un million de signatures non authentifiées.",https://www.lemonde.fr/politique/article/2025/09/17/la-petition-de-philippe-de-villiers-sur-l-immigration-une-initiative-du-groupe-bollore-qui-embarrasse-les-partis_6641473_823448.html,Premium,,,https://img.lemde.fr/2025/09/16/0/0/4475/2983/664/442/75/0/2c77871_upload-1-zjiuuz5jt2ho-000-36up9up.jpg
"Au centre de l’enquête sur l’assassinat de Charlie Kirk, l’ADN de Tyler Robinson et ses échanges avec ses parents et la personne avec laquelle il habitait","Le procureur a annoncé requérir la peine de mort en s’appuyant « uniquement sur les preuves disponibles, les circonstances et la nature du crime ». L’accusé, âgé de 22 ans, avait avoué son acte à ses proches, avant de se rendre.",https://www.lemonde.fr/international/article/2025/09/17/tyler-robinson-inculpe-pour-l-assassinat-de-charlie-kirk-au-c-ur-de-l-acte-d-accusation-l-adn-du-tireur-et-ses-echanges-avec-ses-parents-et-son-colocataire_6641465_3210.html,Premium,,,https://img.lemde.fr/2025/09/17/0/0/3000/2000/664/442/75/0/5d20818_upload-1-ncbzex0giyg6-162156.jpg
"Comment le clan Yoda a perdu son emprise sur la Paternelle, une cité de Marseille longtemps « pourrie » par le trafic de drogue","Une patiente et méthodique enquête de l’Office anti-stupéfiants a abouti au démantèlement du clan qui avait mis sous sa coupe ce quartier de la ville, et à l’arrestation de son chef, Félix Bingui, prochainement jugé.",https://www.lemonde.fr/sante/article/2025/09/17/trafic-de-drogue-a-marseille-comment-yoda-a-perdu-son-emprise-sur-la-cite-de-la-paternelle_6641469_1651302.html,Premium,,,https://img.lemde.fr/2025/09/16/0/0/5808/3872/664/442/75/0/38e254e_upload-1-zbuvv7p57cov-maxnewsworldsix132062.jpg
"Après l’assassinat de Charlie Kirk, les Etats-Unis embourbés dans la violence politique",,https://www.lemonde.fr/idees/article/2025/09/17/assassinat-de-charlie-kirk-les-etats-unis-embourbes-dans-la-violence-politique_6641503_3232.html,,,,
« Les principales puissances moyen-orientales semblent prisonnières de leur dépendance vis-à-vis des Etats-Unis et des liens de ces derniers avec Israël »,,https://www.lemonde.fr/idees/article/2025/09/17/les-principales-puissances-moyen-orientales-semblent-prisonnieres-de-leur-dependance-vis-a-vis-des-etats-unis-et-des-liens-de-ces-derniers-avec-israel_6641529_3232.html,Premium,Gilles Paris Editorialiste au « Monde »,,https://img.lemde.fr/2017/09/22/0/0/0/0/100/100/60/0/f2df5fa_237.jpg
"La « coalition », cet art subtil des négociations et du compromis que la France peine à maîtriser",,https://www.lemonde.fr/idees/article/2025/09/17/la-coalition-cet-art-subtil-des-negociations-et-du-compromis-que-la-france-peine-a-maitriser_6641464_3232.html,Premium,Anne Chemin,,
