Title,Subhead,Article URL,Premium,Byline,Article Type,Image URL
Xi set to welcome Trump from a position of strength,"The US president is due to visit China from Wednesday, at a time when he is embroiled in the conflict with Tehran, of which Beijing is a partner. Meanwhile, the oil and gas crisis linked to the blockade of the Strait of Hormuz has spared China, which had taken steps to protect itself from this type of risk.",https://www.lemonde.fr/en/international/article/2026/05/13/xi-set-to-welcome-trump-from-a-position-of-strength_6753387_4.html,Premium,,,https://img.lemde.fr/2026/05/13/33/0/7467/4978/400/266/75/0/75376a4_ftp-1-aamy48ys7c67-2026-05-13t013005z-681416065-rc2z7lagcunz-rtrmadp-3-china-usa.JPG
"French Foreign Minister Jean-Noël Barrot: 'In Africa, as elsewhere in the world, Russia has been largely defeated'",,https://www.lemonde.fr/en/le-monde-africa/article/2026/05/13/french-foreign-minister-jean-noel-barrot-in-africa-as-elsewhere-in-the-world-russia-has-been-largely-defeated_6753383_124.html,Premium,,,https://img.lemde.fr/2025/07/01/561/0/4480/2986/398/265/75/0/80dee02_upload-1-vm0zhjv6v3d6-barrot-alcock-023.JPG
Iran says US must accept its peace plan or face 'failure',,https://www.lemonde.fr/en/international/article/2026/05/13/iran-says-us-must-accept-its-peace-plan-or-face-failure_6753381_4.html,,,,https://img.lemde.fr/2026/05/12/0/0/3916/2611/398/265/75/0/0cfe782_ftp-1-zkargifxfxzn-5009004-01-06.jpg
Assemblée Nationale inquiry commission exposes deep flaws in France's museum security model,A report released on May 13 calls for increased resources to secure museums as well as a complete overhaul of the museum leadership appointment process.,https://www.lemonde.fr/en/culture/article/2026/05/13/assemblee-nationale-inquiry-commission-exposes-deep-flaws-in-france-s-museum-security-model_6753386_30.html,Premium,,,https://img.lemde.fr/2026/05/11/0/0/8640/5760/398/265/75/0/27acd95_upload-1-sf29f6xqmtfe-000-79ar7mv.jpg
"In Nairobi, France makes a push to invest in Africa","Paris declared its ambition to invest in the continent at the Africa Forward Summit, which opened on May 11 in the heart of the Kenyan capital. Competition, however, is fierce across these dynamic markets.",https://www.lemonde.fr/en/international/article/2026/05/13/in-nairobi-france-makes-a-push-to-invest-in-africa_6753389_4.html,Premium,,,https://img.lemde.fr/2026/05/12/0/0/5500/3666/398/265/75/0/42ba922_ftp-1-idh334pmyyx3-2026-05-12t073759z-874353855-rc2j7lab4a2e-rtrmadp-3-africa-france-summit.JPG
Stars descend on the carpet as Cannes Film Festival 2026 opens without Hollywood backing,"As usual in the build-up to the festival, off-screen events have dominated conversation, from the impact of AI on jobs, Hollywood's decision to ghost the event and the under-representation of women directors.",https://www.lemonde.fr/en/culture/article/2026/05/13/stars-descend-on-the-carpet-as-cannes-film-festival-2026-opens-without-hollywood-backing_6753384_30.html,,,,https://img.lemde.fr/2026/05/12/0/1/5452/3635/398/265/75/0/48baefc_ftp-1-yypsokyl6ch5-2026-05-12t191856z-1360252445-up1em5c1dov96-rtrmadp-3-filmfestival-cannes-opening-ceremony.JPG
"The shattered Iranian lives of Manije, Mohammad-Reza and Soroush, all killed by bombings","Before the Israeli-US bombings began, they were living as retirees and artists in different parts of Tehran. Until they met their deaths in their own homes. Tormented by distress, their loved ones abroad and in Iran recount their last conversations before fate took a tragic turn.",https://www.lemonde.fr/en/international/article/2026/05/13/the-shattered-iranian-lives-of-manije-mohammad-reza-and-soroush-all-killed-by-bombings_6753388_4.html,Premium,,,https://img.lemde.fr/2026/05/06/338/0/1147/764/664/442/75/0/6be5052_upload-1-baw8jihap9it-manijeh.jpeg
Gaza's displaced persons' camps are overrun by rats,,https://www.lemonde.fr/en/international/article/2026/05/13/gaza-s-displaced-persons-camps-are-overrun-by-rats_6753385_4.html,Premium,,,https://img.lemde.fr/2026/05/12/0/0/6720/4480/198/132/95/0/5d0ff49_upload-1-lw5plb65gcqe-2026-04-20t000000z-875771797-mt1imgost000z3wgxs-rtrmadp-3-imago-images.JPG
Strait of Hormuz: UN seeks to secure fertilizer shipments to fragile countries to prevent famines,,https://www.lemonde.fr/en/environment/article/2026/05/12/strait-of-hormuz-un-seeks-to-secure-fertilizer-shipments-to-fragile-countries-to-prevent-famines_6753380_114.html,Premium,,,https://img.lemde.fr/2026/05/12/0/0/6984/4656/198/132/95/0/4b85815_upload-1-hl44vdwp76xt-000-84fb4ke.jpg
October 7: New report documents extent of sexual violence committed by Hamas,,https://www.lemonde.fr/en/international/article/2026/05/12/october-7-new-report-documents-extent-of-sexual-violence-committed-by-hamas_6753371_4.html,Premium,,,https://img.lemde.fr/2023/10/28/0/0/4723/3149/198/132/95/0/b935c65_1698474787706-lvds8270-a-10-23.jpg
UK PM Starmer fights for political survival as calls for his resignation grow,,https://www.lemonde.fr/en/international/article/2026/05/12/um-pm-starmer-fights-for-political-survival-as-calls-for-his-resignation-grow_6753370_4.html,,,,https://img.lemde.fr/2026/05/12/0/0/6564/4376/198/132/95/0/4c34dd4_ftp-1-eq63gszcbz9w-5189f030f39541f5a36fe650ed7b159e-0-bff476382d37404d874f817b671f507c.jpg
Shipping giant CMA CGM uses its fortune to expand its empire on land,,https://www.lemonde.fr/en/economy/article/2026/05/12/shipping-giant-cma-cgm-uses-its-fortune-to-expand-its-empire-on-land_6753376_19.html,Premium,,,
Scientists warn 2026 could be extreme year as global warming slips down agenda,,https://www.lemonde.fr/en/environment/article/2026/05/12/scientists-warn-2026-could-be-extreme-year-as-global-warming-slips-down-agenda_6753372_114.html,Premium,,,
Seine murders: Psychiatric assessment finds suspect cannot be held criminally responsible,,https://www.lemonde.fr/en/france/article/2026/05/12/seine-murders-psychiatric-assessment-finds-suspect-cannot-be-held-criminally-responsible_6753374_7.html,Premium,,,
Ukraine seeks to broaden diplomatic horizon by selling arms,,https://www.lemonde.fr/en/international/article/2026/05/12/ukraine-seeks-to-broaden-diplomatic-horizon-by-selling-arms_6753377_4.html,Premium,,,
Macron says hantavirus situation 'under control' in France,,https://www.lemonde.fr/en/health/article/2026/05/13/macron-says-hantavirus-situation-under-control-in-france_6753382_14.html,,,,
"Epstein files on display at New York pop-up exhibit, all 3.5 million pages",,https://www.lemonde.fr/en/international/article/2026/05/12/epstein-files-on-display-at-new-york-pop-up-exhibit-all-3-5-million-pages_6753364_4.html,,,,
Two killed in shooting as violent turf war erupts over drug dealing hotspots in Nice,,https://www.lemonde.fr/en/france/article/2026/05/12/nice-two-killed-in-shooting-as-violent-turf-war-erupts-over-drug-dealing-hotspots_6753367_7.html,Premium,,,
"Hantavirus: How great is the transmission risk, as each country sets its own quarantine rules?",,https://www.lemonde.fr/en/environment/article/2026/05/12/hantavirus-how-great-is-the-transmission-risk-as-each-country-sets-its-own-quarantine-rules_6753368_114.html,Premium,,,
"Eye Haïdara, master of ceremonies at the Cannes Film Festival: 'When you're on stage, you're in charge! You're untouchable'","The actress, who rose to fame in France in 2017, paid tribute to her primary school teacher, who inspired her passion for theater.",https://www.lemonde.fr/en/culture/article/2026/05/12/eye-haidara-master-of-ceremonies-at-the-cannes-film-festival-when-you-re-on-stage-you-re-in-charge-you-re-untouchable_6753375_30.html,Premium,,,https://img.lemde.fr/2026/05/08/0/0/5508/3672/664/442/75/0/b9da33b_upload-1-tmnylw5lwyif-festivaldecannes2026-eyehac3afdara2cmac3aetressedecc3a9rc3a9monie.jpg
"French far-right mayors' first steps target Europe, culture and unions","Le Monde examined the first decisions made by newly-elected far-right mayors. While they have not yet kept their tax promises, almost all of them have increased their own allowances, hired police officers and targeted local figures who are politically hostile to them.",https://www.lemonde.fr/en/politics/article/2026/05/12/new-far-right-mayors-first-steps-target-europe-culture-and-unions_6753361_5.html,Premium,,,https://img.lemde.fr/2026/05/08/0/0/6910/4607/664/442/75/0/f707d25_ftp-1-3ztmkuwqdj0x-5976392-01-06.jpg
Cannes Film Festival sees last artists walk the red carpet before the 2027 presidential election,"The 79th edition of the film festival, opening on Tuesday, May 12, is set to be a highly political event in the city, as it is by David Lisnard, a declared presidential candidate who advocates for a right-wing primary including the far right.",https://www.lemonde.fr/en/culture/article/2026/05/11/cannes-film-festival-sees-last-artists-walk-the-red-carpet-before-the-2027-presidential-election_6753347_30.html,Premium,,,https://img.lemde.fr/2026/05/08/1823/0/3333/2222/664/442/75/0/1854124_upload-1-y8he7fnecbrv-sipa-01266453-000021.jpg
'Israel's impunity in Gaza can only encourage it to be just as ruthless in Lebanon',,https://www.lemonde.fr/en/opinion/article/2026/05/10/israel-s-impunity-in-gaza-can-only-encourage-it-to-be-just-as-ruthless-in-lebanon_6753307_23.html,Premium,Jean-Pierre Filiu Historian and professor at Sciences Po Paris,,https://img.lemde.fr/2023/07/31/0/0/0/0/100/100/60/0/d45bb07_1690791602941-eac5c14-1647333440018-jean-pierre-filiu-2019.jpg
"Suspicious transactions on oil markets: 'On Wall Street, this sense of impunity is clearly widespread'",,https://www.lemonde.fr/en/opinion/article/2026/05/12/suspicious-transactions-on-oil-markets-on-wall-street-this-sense-of-impunity-is-clearly-widespread_6753357_23.html,Premium,Nicolas Chapuis New York (United States) correspondent,,
'The word 'masculinism' is deeply inappropriate and depoliticizes feminism',,https://www.lemonde.fr/en/opinion/article/2026/05/10/genevieve-fraisse-the-word-masculinism-is-deeply-inappropriate-and-depoliticizes-feminism_6753312_23.html,Premium,Anne-Toscane Viudes,,
