Title,Subhead,Article URL,Premium,Byline,Article Type,Image URL
"« C’est très beau le parvis de l’Hôtel-de-Ville, mais c’est du kit végétal » : les défis du développement des « forêts urbaines »",,,Premium,,,
Les nombreuses analogies entre les Etats-Unis de Trump et ceux des « barons voleurs » de 1890,,,Premium,,,
Expulsion de squatteurs et faute de l’huissier,,,Premium,Rafaële Rivais,,
"« Les racines du mal budgétaire français sont à chercher au-delà de nos frontières, dans l’échec d’un système fiscal international à bout de souffle »",,,Premium,Virginie Amieux Présidente du CCFD-Terre Solidaire,,
Pourquoi la Russie utilise tellement de drones iraniens Shahed pour attaquer l’Ukraine,,,Premium,,,
"En Russie, des jeunes femmes africaines contraintes de fabriquer des drones de combat",,,Premium,,,
Pourquoi tout le monde s’arrache l’Arctique ? Comprendre en trois minutes,,,,,,
Hiroshima : comment s’est déroulé le bombardement atomique le plus dévastateur de l’histoire,,,Premium,,,
Nouvelle-Calédonie : un accord à remettre sur le métier,,,,,,
« Je ne résiste pas à l’envie de demander à André Comte-Sponville : “A quoi penses-tu quand tu fais un pot-au-feu ?” »,,,Premium,Mara Goyet Ecrivaine,,
"Pour les entreprises françaises, une reprise des fusions et acquisitions est attendue dès la rentrée",,,Premium,,,
"Dominique Rousseau, juriste : « Supprimer le Conseil constitutionnel ou l’affaiblir serait aussi dangereux que supprimer les freins d’une voiture »",,,Premium,Dominique Rousseau Constitutionnaliste,,
"Avec « En boucle », Junta Yamaguchi fait tourner un manège cinématographique follement ludique",,,Premium,,,
"A quoi va ressembler la rentrée littéraire 2025 : Emmanuel Carrère, Catherine Millet, Alain Mabanckou, Audur Ava Olafsdottir…",,,Premium,,,
"« Fille de la nation », sur Canal+ : Zdenka Havlickova, une figure oubliée de l’histoire tchèque",,,Premium,,,
"A Saint-Rémy-de-Provence, une plongée dans l’arène taurine et torride de Picasso",,,Premium,,,
"Voyage à Ratonneau et Pomègues, entre mistral et immortelles",,,Premium,,,
"Louise Trotter, la manière sobre",,,Premium,,,
"Que faire, que voir, où aller ? L’agenda culturel et art de vivre en France à partir du 16 août",,,Premium,,,
"Routiers et restos étoilés : la nationale 7, une artère qui fait recette",,,Premium,,,
Live  Article se déroulant en direct   Vladimir Poutine et Donald Trump disent s’être entendus « sur de nombreux points » sans pour autant annoncer un accord sur la guerre en Ukraine,"Les deux chefs d’Etat se sont entretenus, vendredi, en compagnie de leurs conseillers, pendant près de trois heures en Alaska. Le président russe a dit espérer que « l’entente » trouvée pourra ouvrir « la voie à la paix en Ukraine », sans en préciser la teneur. Pour son homologue américain, un accord de paix « dépend » maintenant de Volodymyr Zelensky.",https://www.lemonde.fr/international/live/2025/08/16/en-direct-rencontre-poutine-trump-en-alaska-les-deux-dirigeants-disent-s-etre-entendus-sur-de-nombreux-points-sans-pour-autant-annoncer-d-accord_6627648_3210.html,Premium,,,https://img.lemde.fr/2025/08/16/0/0/4500/3000/600/400/75/0/e36861f_ftp-import-images-1-wpiq7vlidyid-7bf525c872bf41e98dbf9326bd7e1790-0-8563846558e54356a76ac435e1bef3e8.jpg
"Canicule : 54 départements en vigilance orange samedi, incendies et pollution dans le sud de la France",La canicule devrait perdurer jusqu’à samedi en fin de journée avant de régresser par le nord et l’ouest dimanche et surtout lundi.,https://www.lemonde.fr/climat/article/2025/08/16/canicule-66-departements-en-vigilance-orange-samedi-incendies-et-pollution-dans-le-sud-de-la-france_6630051_1652612.html,,,,https://img.lemde.fr/2025/08/15/0/0/7945/5296/398/265/75/0/9b079d2_ftp-import-images-1-5o9oxovawowy-5639099-01-06.jpg
"En Chine, l’industrie du robot est mise en ébullition par les promesses d’un marché à 5 000 milliards de dollars","Conférence planétaire, puis jeux robotiques dans le Stade national : Pékin est, du 8 au 17 août, la capitale mondiale des robots. Une façon de montrer l’extraordinaire accélération de la Chine dans ce secteur, aussi bien du côté des bras industriels automatisés que des humanoïdes dopés à l’intelligence artificielle.",https://www.lemonde.fr/economie/article/2025/08/16/en-chine-l-industrie-du-robot-est-mise-en-ebullition-par-les-promesses-d-un-marche-a-5-000-milliards-de-dollars_6630086_3234.html,Premium,,,https://img.lemde.fr/2025/08/14/0/0/4617/3078/398/265/75/0/a2f0f3a_upload-1-exaa35muc5pi-033009.jpg
"Ligue 1 : Marseille ouvre sa saison par une défaite à Rennes, pourtant réduit à dix","L’Olympique de Marseille, en supériorité numérique pendant une heure et malgré deux poteaux touchés, a cédé en Bretagne, vendredi soir, sur un but dans le temps additionnel de Ludovic Blas (0-1). Cette rencontre a lancé la nouvelle saison de ligue 1 qui se poursuit samedi.",https://www.lemonde.fr/sport/article/2025/08/15/ligue-1-marseille-ouvre-sa-saison-par-une-defaite-a-rennes-pourtant-reduit-a-dix_6629952_3242.html,,,,https://img.lemde.fr/2025/08/15/0/52/3069/2046/398/265/75/0/396da0b_ftp-import-images-1-funzvfmsttae-2025-08-15t205536z-1541383095-up1el8f1m4mnt-rtrmadp-3-soccer-france-ren-om.JPG
"« La France, que j’avais tant idéalisée, était une échappatoire » : les premiers jours en France de Katie Beth Kelley, venue des Etats-Unis","« Exils » (16/30). Fuir l’éducation puritaine qui la corsetait était l’objectif initial de Katie Beth Kelley, à son arrivée en 2007. Mais se faire à la culture hexagonale n’a pas été évident. Dix-huit ans plus tard, cette Américaine de 39 ans s’épanouit à Montmartre.",https://www.lemonde.fr/series-d-ete/article/2025/08/16/la-france-que-j-avais-tant-idealisee-en-lisant-des-livres-etait-une-echappatoire-les-premiers-jours-en-france-de-katie-beth-kelley-venue-des-etats-unis_6630087_3451060.html,Premium,,,https://img.lemde.fr/2025/07/17/0/0/1200/800/664/442/75/0/ca2293f_upload-1-p33w7qkfyefr-vignette.jpg
Pollution plastique : l’obstruction des pays pétroliers entraîne un échec cuisant des négociations sur un traité international,,https://www.lemonde.fr/planete/article/2025/08/15/pollution-plastique-l-obstruction-des-pays-petroliers-entraine-un-echec-cuisant-des-negociations-sur-un-traite-international_6629921_3244.html,Premium,,,https://img.lemde.fr/2025/08/14/0/0/7914/5276/198/132/95/0/5bf0853_upload-1-zdnyxmvv26gh-561243.jpg
Changement climatique : le sud de l’Europe accablé par les flammes et une chaleur extrême,,https://www.lemonde.fr/planete/article/2025/08/16/changement-climatique-le-sud-de-l-europe-accable-par-les-flammes-et-une-chaleur-extreme_6630088_3244.html,Premium,,,https://img.lemde.fr/2025/08/15/1/0/5005/3336/198/132/95/0/7a20b36_upload-1-l2gsaeczdav9-046674.jpg
Un accord entre la ville de Washington et l’administration Trump sur la prise en main de la police dans la capitale,,https://www.lemonde.fr/international/article/2025/08/16/un-accord-entre-la-ville-de-washington-et-l-administration-trump-sur-la-prise-en-main-de-la-police-dans-la-capitale_6630018_3210.html,,,,https://img.lemde.fr/2025/08/15/0/2/4434/2956/198/132/95/0/aede424_ftp-import-images-1-epr5prb1t66i-5641996-01-06.jpg
Comment l’école a timidement ouvert la voie à la mixité sportive entre filles et garçons,,https://www.lemonde.fr/series-d-ete/article/2025/08/16/comment-l-ecole-a-timidement-ouvert-la-voie-a-la-mixite-sportive-entre-filles-et-garcons_6630192_3451060.html,Premium,,,https://img.lemde.fr/2025/08/12/0/0/3000/2000/198/132/95/0/9a5264d_upload-1-6a8dvkalfhyj-piscine.jpg
"A quoi va ressembler la rentrée littéraire 2025 : Emmanuel Carrère, Catherine Millet, Alain Mabanckou, Audur Ava Olafsdottir…",,https://www.lemonde.fr/livres/article/2025/08/15/rentree-litteraire-2025-emmanuel-carrere-catherine-millet-alain-mabanckou-audur-ava-olafsdottir-lectures-prometteuses_6629686_3260.html,Premium,,,https://img.lemde.fr/2025/08/13/1/0/7488/4992/198/132/95/0/92bb23c_upload-1-ervmclhvfgbu-000-34pk7vq.jpg
Cadavres retrouvés dans la Seine : une enquête pour homicide ouverte pour l’un des quatre corps,,https://www.lemonde.fr/societe/article/2025/08/15/cadavres-retrouves-dans-la-seine-une-enquete-pour-homicide-ouverte-pour-l-un-des-quatre-corps_6629942_3224.html,,,,https://img.lemde.fr/2025/08/15/0/0/7206/4804/198/132/95/0/33192e4_upload-1-mdobb6zjgdvl-731068.jpg
"En direct, Gaza : le point sur la situation",,https://www.lemonde.fr/international/live/2025/08/16/en-direct-gaza-le-point-sur-la-situation_6628849_3210.html,,,,
"« Un enfant né en 2020 vit l’été 2025 comme un été brûlant, mais le même été lui semblera normal une fois adulte »",,https://www.lemonde.fr/planete/article/2025/08/15/cette-canicule-incarne-la-realite-du-rechauffement-climatique-et-aide-a-la-prise-de-conscience_6629926_3244.html,Premium,,,
"Pink Floyd, le meilleur ennemi du punk",,https://www.lemonde.fr/series-d-ete/article/2025/08/15/pink-floyd-le-meilleur-ennemi-du-punk_6629944_3451060.html,Premium,,,
"« Depuis 2021, la guerre menée contre les femmes est peu à peu remportée par les talibans »",,https://www.lemonde.fr/idees/article/2025/08/15/depuis-2021-la-guerre-menee-contre-les-femmes-est-peu-a-peu-remportee-par-les-talibans_6629900_3232.html,Premium,,,
"Dans l’Allier, des catholiques identitaires mettent en scène leur vision de l’histoire avec le soutien de la droite",,https://www.lemonde.fr/politique/article/2025/08/16/dans-l-allier-des-catholiques-identitaires-mettent-en-scene-leur-vision-de-l-histoire-avec-le-soutien-de-la-droite_6630084_823448.html,Premium,,,
"« Qui va survivre ? » : « Game of Thrones », un jeu de massacre d’une violence inouïe",,https://www.lemonde.fr/series-d-ete/article/2025/08/16/qui-va-survivre-game-of-thrones-un-jeu-de-massacre-d-une-violence-inouie_6630085_3451060.html,Premium,,,
De la chirurgie esthétique à la pédicure « russian » : rien n’est trop beau pour les pieds,,https://www.lemonde.fr/series-d-ete/article/2025/08/16/de-la-chirurgie-esthetique-a-la-pedicure-russian-rien-n-est-trop-beau-pour-les-pieds_6630155_3451060.html,Premium,,,
"Abattage d’un olivier à la mémoire d’Ilan Halimi : pour Emmanuel Macron, la République sera « toujours intransigeante » face à l’antisémitisme",,https://www.lemonde.fr/societe/article/2025/08/15/une-enquete-a-ete-ouverte-apres-qu-un-olivier-rendant-hommage-a-ilan-halimi-a-ete-abattu-a-epinay-sur-seine_6629542_3225.html,,,,
Classement de Shanghaï 2025 : Paris-Saclay se maintient dans le « top 15 »,"Les Etats-Unis dominent toujours le palmarès, avec huit des dix premières places. Outre Paris-Saclay, trois universités françaises figurent parmi les cent premières : Paris Sciences et lettres, Sorbonne Université et l’université Paris Cité.",https://www.lemonde.fr/societe/article/2025/08/15/classement-de-shanghai-2025-paris-saclay-se-maintient-dans-le-top-15_6629690_3224.html,Premium,,,https://img.lemde.fr/2025/08/15/0/2/3069/2046/664/442/75/0/60a7a7c_upload-1-c75dvtgrreqq-plan-de-travail-1-3x.png
"A Capri, la villa Lysis, le baron et ses trop jeunes favoris","« L’Italie par ses villas » (5/6). Dans le golfe de Naples, les majestueuses bâtisses ont abrité les frasques et les larmes d’idéalistes de la haute société européenne venus s’y réfugier dès le XIXᵉ siècle. Plus tard, la lumière de l’île a attiré les nazis et les fascistes comme les révolutionnaires russes.",https://www.lemonde.fr/series-d-ete/article/2025/08/15/a-capri-la-villa-lysis-le-baron-et-ses-trop-jeunes-favoris_6629644_3451060.html,Premium,,,https://img.lemde.fr/2025/07/14/0/2/5367/3578/664/442/75/0/a826ee9_upload-1-7syfrpeh90fx-2c3xym9.jpg
"Entre Trump et Poutine, une longue relation opaque et toxique","Le président américain nourrit depuis près de vingt ans une fascination manifeste pour son homologue russe, qu’il doit rencontrer lors d’un sommet consacré à l’Ukraine vendredi, en Alaska. Son empire immobilier a largement bénéficié de capitaux privés russes.",https://www.lemonde.fr/international/article/2025/08/15/entre-donald-trump-et-vladimir-poutine-une-relation-toxique-et-opaque_6629682_3210.html,Premium,,,https://img.lemde.fr/2025/02/08/0/0/3301/2200/664/442/75/0/6a0efd2_ftp-import-images-1-cmmcrqiy203w-c85f542bb6bc47539426d5d7eb274415-1-d3dd7d2648ee40e8b6e46d6152f731f1.jpg
"David Grossman, écrivain israélien : « Je cherche à me ménager un accès direct au cœur de l’incendie »",,https://www.lemonde.fr/series-d-ete/article/2025/08/14/david-grossman-je-cherche-a-me-menager-un-acces-direct-au-c-ur-de-l-incendie_6629221_3451060.html,Premium,Nicolas Weill,,
"« La présence militaire américaine au Japon a toujours été destinée à assurer une ligne de défense face à la Chine et la Russie, plus qu’à protéger l’Archipel »",,https://www.lemonde.fr/international/article/2025/08/15/la-presence-militaire-americaine-au-japon-a-toujours-ete-destinee-a-assurer-une-ligne-de-defense-face-a-la-chine-et-la-russie-plus-qu-a-proteger-l-archipel_6629914_3210.html,Premium,"Philippe Pons Tokyo, correspondant",,
Nouvelle-Calédonie : un accord à remettre sur le métier,,https://www.lemonde.fr/idees/article/2025/08/14/nouvelle-caledonie-un-accord-a-remettre-sur-le-metier_6629460_3232.html,,,,
