Title,Subhead,Article URL,Premium,Byline,Article Type,Image URL
Romania wakes up to its vulnerability to Russian drones: 'We are theoretically in a country at peace',"For the first time since Russia invaded Ukraine, a Russian drone struck a residential building in Romania on May 29, injuring two people. The incident in the city of Galati, near the Ukrainian border, has exposed the civil protection system's flaws, the poor condition of shelters and the lack of public information.",https://www.lemonde.fr/en/international/article/2026/06/03/romania-wakes-up-to-its-vulnerability-to-russian-drones-we-are-theoretically-in-a-country-at-peace-and-this-should-not-happen_6754070_4.html,Premium,,,https://img.lemde.fr/2026/06/02/0/0/5677/3785/400/266/75/0/512839b_upload-1-rcv65g76x92s-pun08.JPG
"'I am available,' investment banker Matthieu Pigasse tells the left ahead of 2027 election",,https://www.lemonde.fr/en/politics/article/2026/06/03/2027-french-presidential-election-i-am-available-investment-banker-matthieu-pigasse-tells-the-left_6754073_5.html,Premium,,,https://img.lemde.fr/2026/06/01/1432/0/5504/3669/398/265/75/0/1800b9c_upload-1-6gxisuanrklj-ag5081026.jpg
"Denis Mukwege, Nobel Peace Prize laureate: 'This Ebola outbreak could become the deadliest ever'",,https://www.lemonde.fr/en/opinion/article/2026/06/03/denis-mukwege-nobel-peace-prize-laureate-this-ebola-outbreak-could-become-the-deadliest-ever_6754076_23.html,Premium,,,https://img.lemde.fr/2026/05/29/0/4/3592/2395/398/265/75/0/0382ccb_ftp-1-nelc41b54lfm-5173632-01-06.jpg
2026 World Cup poses massive security challenge for US law enforcement,"For the first time, the tournament will feature 48 teams and be played across three countries, all amid heightened geopolitical tensions. US authorities are already working behind the scenes to ensure the event runs safely and smoothly.",https://www.lemonde.fr/en/sports/article/2026/06/02/2026-world-cup-poses-massive-security-challenge-for-us-law-enforcement_6754065_9.html,Premium,,,https://img.lemde.fr/2026/05/27/0/0/6811/4540/398/265/75/0/6426b98_ftp-1-nzncisrazn2n-2026-05-27t233950z-144780027-mt1usatoday29069583-rtrmadp-3-soccer-fifa-world-cup-2026-immigrant-rights-group-rally.JPG
Turkey has a quiet but strategic presence in Mali,"Over the past decade, trade between Ankara and Bamako has more than tripled, and, since 2024, arms and ammunition have become Turkey's leading exports to Mali.",https://www.lemonde.fr/en/le-monde-africa/article/2026/06/03/turkey-is-a-quiet-but-strategic-presence-in-mali_6754074_124.html,Premium,,,https://img.lemde.fr/2026/05/18/0/0/7072/4714/398/265/75/0/ae024de_ftp-1-v32sbwz3dp6x-804a744ae5a24393b11c21748d5cc27b-0-4a894898b3d74ac5bce91497395dbea2.jpg
Les Nuits de Fourvière in Lyon unveils a vibrant program to celebrate the festival's 80th anniversary,"Running through July 25, the festival features 60 open-air shows, concerts, performances and masked balls, including 'To See the Stars Again' by the Australian contemporary circus troupe Circa.",https://www.lemonde.fr/en/culture/article/2026/06/03/les-nuits-de-fourviere-in-lyon-unveils-a-vibrant-program-to-celebrate-the-festival-s-80th-anniversary_6754072_30.html,Premium,,,https://img.lemde.fr/2026/06/02/0/0/11520/7680/398/265/75/0/b55a7bb_upload-1-qflcxh9rw21q-to-see-the-stars-again-photography-by-nick-mitmanski-4-raw.jpg
'The Palme d'Or of French hospitality': Government unveils new list of France's 33 most luxurious hotels,"The government's latest 'Palaces de France' list was revealed on June 2, with six new additions and four removals. The label aims to showcase this flagship sector of French expertise, even though the establishments' owners are rarely French.",https://www.lemonde.fr/en/economy/article/2026/06/03/it-s-the-palme-d-or-of-french-hospitality-the-government-unveils-its-updated-list-of-the-33-most-luxurious-hotels-in-france_6754066_19.html,Premium,,,https://img.lemde.fr/2026/06/02/0/0/6000/4000/664/442/75/0/8b188a7_ftp-1-nsgqnwgd4etm-5204178-01-06.jpg
Europe once again signals openness to dialogue with Putin,,https://www.lemonde.fr/en/international/article/2026/06/02/ukraine-war-europe-once-again-signals-openness-to-dialogue-with-putin_6754061_4.html,Premium,,,https://img.lemde.fr/2026/06/01/0/0/4000/2666/198/132/95/0/02f367f_upload-1-ufa8syjln2f3-sipa-shutterstock41340942-000001.jpg
Denmark's Mette Frederiksen secures third term as prime minister,,https://www.lemonde.fr/en/international/article/2026/06/03/denmark-s-mette-frederiksen-secures-third-term-as-prime-minister_6754068_4.html,Premium,,,https://img.lemde.fr/2026/06/01/0/0/3559/2373/198/132/95/0/e6d818c_ftp-1-zl24az6dh9pn-5200078-01-06.jpg
French lawmakers say state shares blame for chlordecone pesticide scandal,,https://www.lemonde.fr/en/health/article/2026/06/03/french-lawmakers-say-state-shares-blame-for-chlordecone-pesticide-scandal_6754077_14.html,,,,https://img.lemde.fr/2023/11/03/0/0/5106/3404/198/132/95/0/d76ee19_1699027382680-860134.jpg
US says it thwarted Iranian missile and drone attacks after strikes in Strait of Hormuz,,https://www.lemonde.fr/en/international/article/2026/06/03/us-says-thwarts-iranian-missile-and-drone-attacks-after-strikes-on-target-in-strait-of-hormuz_6754071_4.html,,,,https://img.lemde.fr/2026/03/16/0/0/4030/2687/198/132/95/0/e3fac57_ftp-1-yguic7r6vm2t-2026-03-16t214131z-171769475-rc29u4ah3trk-rtrmadp-3-iran-nuclear-hormuz-strait.JPG
French agriculture bill makes it easier to store water and expand livestock farms,,https://www.lemonde.fr/en/environment/article/2026/06/02/french-agriculture-bill-makes-it-easier-to-store-water-and-expand-livestock-farms_6754047_114.html,Premium,,,
Why consumer electronics prices are surging,,https://www.lemonde.fr/en/pixels/article/2026/06/02/why-consumer-electronics-prices-are-surging_6754040_13.html,Premium,,,
France inaugurates memorial to victims of Rwandan genocide,,https://www.lemonde.fr/en/culture/article/2026/06/02/france-inaugurates-memorial-to-victims-of-rwandan-genocide_6754052_30.html,Premium,,,
Violence amid PSG celebrations is punished with prison: 'Are we living in a society of chaos? No',,https://www.lemonde.fr/en/france/article/2026/06/02/violence-amid-psg-celebrations-is-punished-with-prison-are-we-living-in-a-society-of-chaos-no_6754063_7.html,Premium,,,
EU aims for 'technological sovereignty' with push for homegrown tech,,https://www.lemonde.fr/en/international/article/2026/06/03/eu-targets-technological-sovereignty-with-push-for-homegrown-tech-and-distance-with-us-and-asia_6754075_4.html,,,,
"EU adopts drastic expulsion rules for undocumented migrants, including 'return platforms'",,https://www.lemonde.fr/en/international/article/2026/06/02/eu-adopts-drastic-expulsion-rules-for-undocumented-migrants-including-return-platforms_6754045_4.html,Premium,,,
Outrage grows in Britain after footage shows dying stabbing victim handcuffed by police,,https://www.lemonde.fr/en/international/article/2026/06/03/outrage-grows-in-britain-after-footage-shows-dying-stabbing-victim-handcuffed-by-police_6754067_4.html,,,,
France experiences its hottest spring ever recorded,,https://www.lemonde.fr/en/france/article/2026/06/02/france-experiences-its-hottest-spring-ever-recorded_6754051_7.html,,,,
The 20 French cities where the country's wealthiest live,"The city of Neuilly-sur-Seine outside Paris has the highest proportion of very wealthy households in France, according to a study by the Inequality Observatory published on Tuesday. The ranking is dominated by the western suburbs of Paris and the areas surrounding Geneva.",https://www.lemonde.fr/en/france/article/2026/06/02/the-20-cities-where-france-s-wealthiest-live_6754057_7.html,Premium,,,https://img.lemde.fr/2026/06/02/0/0/4999/3333/664/442/75/0/d31dd0b_upload-1-q7bi6kry8u5x-000-33en7tr.jpg
"French sociologist, philosopher and intellectual provocateur Edgar Morin has died aged 104","Committed to connecting different fields of knowledge to develop his 'complex thought,' this former member of the Resistance and deeply humanist intellectual advocated for a revolution of consciousness. He died in Paris on Friday, his wife confirmed to Le Monde.",https://www.lemonde.fr/en/obituaries/article/2026/05/30/french-sociologist-philosopher-and-intellectual-provocateur-edgar-morin-has-died-aged-104_6753967_15.html,Premium,,,https://img.lemde.fr/2021/01/07/964/0/3898/2598/664/442/75/0/f92b9b9_695241771-edgar-morin-77.jpg
The Fontainebleau Forest's ever-growing popularity threatens this jewel of biodiversity near Paris,Managers of the forest complex are wondering how to deal with the increasing influx of visitors: Will development contain overtourism or encourage it?,https://www.lemonde.fr/en/environment/article/2026/06/02/the-fontainebleau-forest-s-ever-growing-popularity-threatens-this-jewel-of-biodiversity-near-paris_6754039_114.html,Premium,,,https://img.lemde.fr/2026/05/29/0/0/6300/4200/664/442/75/0/add3dfb_upload-1-qy0wlhf7gqr3-20260526-surfrequentation-foret-fontainebleau-46.jpg
"Beyond AI billions, energy emerges as the crucial battleground at Choose France summit",,https://www.lemonde.fr/en/opinion/article/2026/06/02/beyond-ai-billions-energy-emerges-as-the-crucial-battleground-at-choose-france-summit_6754062_23.html,,,,
French presidential election: 'Which of Attal or Glucksmann can form the broadest coalition',,https://www.lemonde.fr/en/opinion/article/2026/06/02/2027-french-presidential-election-which-of-attal-or-glucksmann-can-form-the-broadest-coalition_6754041_23.html,Premium,Françoise Fressoz Columnist,,https://img.lemde.fr/2023/07/06/0/0/0/0/100/100/60/0/bee4e6c_1688634540522-73f3cca-40.jpg
"By backtracking on environmental progress, Macron is 'betraying' the French, former members of the Climate Convention write",,https://www.lemonde.fr/en/opinion/article/2026/05/28/by-backtracking-on-environmental-progress-macron-is-betraying-the-french-former-members-of-the-climate-convention-write_6753898_23.html,Premium,Group letter,,
