Title,Subhead,Article URL,Premium,Byline,Article Type,Image URL
"Weakened at home, Macron counts on 'his' last G7 to boost his diplomatic record","As his second term grows increasingly complex at home amid the killing of 11-year-old Lyhanna, the French president, who is chairing the G7 summit in Evian, is staking his legitimacy on an ambitious international agenda.",https://www.lemonde.fr/en/politics/article/2026/06/16/weakened-at-home-macron-counts-on-his-last-g7-to-boost-his-diplomatic-record_6754526_5.html,Premium,,,https://img.lemde.fr/2026/06/15/467/0/7000/4666/400/266/75/0/7144fe4_upload-1-b2s4db1lowlo-kzihnioglu-evian-g7-15062026-2-10.JPG
"After the US-Iran deal, Israel revels in its military might but finds itself at a strategic impasse",,https://www.lemonde.fr/en/international/article/2026/06/16/after-the-us-iran-deal-israel-revels-in-its-military-might-but-finds-itself-at-a-strategic-impasse_6754523_4.html,Premium,,,https://img.lemde.fr/2026/06/03/0/0/5499/3666/398/265/75/0/91effd5_ftp-1-6lo37ftzcfg1-2026-06-03t114456z-1533352550-rc28mlaqcoyz-rtrmadp-3-israel-politics.JPG
"Iran's hardliners protest US deal, but the regime closes ranks",,https://www.lemonde.fr/en/international/article/2026/06/16/iran-s-hardliners-protest-us-deal-but-the-regime-closes-ranks_6754530_4.html,Premium,,,https://img.lemde.fr/2026/06/14/0/0/7546/5031/398/265/75/0/02bc575_ftp-1-k4lysoniqzjn-e96971ec69a44be1a020b78193756af9-0-9a61536e64f441699cca721e062519b0.jpg
The Fed's Kevin Warsh faces first dilemma: Cut rates to please Trump or raise them to try to contain inflation,"The new chair of the United States central bank is facing accelerating price hikes linked to the conflict in the Middle East, even as the president picked him in hopes that he would lower interest rates.",https://www.lemonde.fr/en/economy/article/2026/06/16/the-fed-s-kevin-warsh-faces-first-dilemma-cut-rates-to-please-donald-trump-or-raise-them-to-try-to-contain-inflation_6754531_19.html,Premium,,,https://img.lemde.fr/2026/05/29/1/0/5500/3666/398/265/75/0/ba37a12_ftp-1-pcjs6bbwy7v2-2026-05-29t100344z-1483023799-rc2cela0wkt0-rtrmadp-3-usa-fed-balance-sheet.JPG
Air quality and global warming: Moving beyond an apparent paradox,"For several decades, many countries have reduced air pollution, improving public health. However, the decrease in sulfur aerosols, particles that reflect the sun's rays, has intensified global warming.",https://www.lemonde.fr/en/opinion/article/2026/06/15/air-quality-and-global-warming-moving-beyond-an-apparent-paradox_6754521_23.html,Premium,,,https://img.lemde.fr/2026/06/12/1/0/6000/4000/398/265/75/0/f308c24_upload-1-qocvqeiey4ov-000-342t93e.jpg
Imprisoned French journalist wasn't at coach Deschamps's press conference. But a fellow reporter made sure his question was asked,"Still behind bars in Algeria, Christoph Gleizes managed to ask a question to the national football team coach on Monday, through a fellow reporter, on the eve of France's first World Cup match against Senegal.",https://www.lemonde.fr/en/sports/article/2026/06/16/2026-world-cup-imprisoned-french-journalist-wasn-t-at-coach-deschamps-s-press-conference-but-a-fellow-reporter-made-sure-his-question-was-asked_6754534_9.html,,,,https://img.lemde.fr/2026/06/15/0/0/5161/3441/398/265/75/0/f89405f_ftp-1-u77rdutzrcky-5327347-01-06.jpg
JR's new and improved Pont-Neuf cavern reopens,"The artist announced on social media on Monday that his ephemeral work, 'La Caverne du Pont-Neuf,' was reopening three days ahead of schedule. It was repaired and strengthened after strong winds had damaged it two weeks ago.",https://www.lemonde.fr/en/culture/article/2026/06/16/jr-s-new-and-improved-pont-neuf-cavern-reopens_6754533_30.html,Premium,,,https://img.lemde.fr/2026/06/06/260/49/2904/1936/664/442/75/0/1150541_upload-1-legduba2lqyc-8408-05.jpg
Eight dead in fiery US B-52 bomber crash in California,,https://www.lemonde.fr/en/international/article/2026/06/16/eight-dead-in-fiery-us-b-52-bomber-crash-in-california_6754525_4.html,,,,https://img.lemde.fr/2026/06/16/64/0/1533/1022/198/132/95/0/865c0ef_ftp-1-42xfct4j73im-1a37ce80693349b2af645c40d22f231c-0-24c747daf771424dafac7a79898dfb4c.jpg
Trump says Strait of Hormuz will be 'completely open' Friday,,https://www.lemonde.fr/en/international/article/2026/06/15/trump-says-strait-of-hormuz-will-be-completely-open-friday_6754517_4.html,,,,https://img.lemde.fr/2026/06/15/0/0/6349/4233/198/132/95/0/043ae3d_ftp-1-wcp6858c2mtp-2026-06-15t170820z-345308429-rc2hula72k2z-rtrmadp-3-g7-summit.JPG
"In Kyiv, a strike damages the Dormition Cathedral at the heart of the historic Kyiv Pechersk Lavra",,https://www.lemonde.fr/en/international/article/2026/06/16/in-kyiv-a-strike-damages-the-dormition-cathedral-at-the-heart-of-the-historic-kyiv-pechersk-lavra_6754527_4.html,Premium,,,https://img.lemde.fr/2026/06/15/0/0/5460/3640/198/132/95/0/7298049_ftp-1-gijadtffccpu-2026-06-15t090521z-1692538372-rc29ula3yki2-rtrmadp-3-ukraine-crisis-attack-kyiv.JPG
Dominique Méda: 'We must make the green transition desirable',,https://www.lemonde.fr/en/opinion/article/2026/06/15/dominique-meda-we-must-make-the-green-transition-desirable_6754520_23.html,Premium,,,https://img.lemde.fr/2026/06/09/1123/0/2667/1778/198/132/95/0/93c27be_upload-1-m1hnouf5xwem-000-84r46bb.jpg
The summer dress theory,,https://www.lemonde.fr/en/france/article/2026/06/15/the-summer-dress-theory_6754512_7.html,Premium,,,
"Nearly six billion fish, crustaceans and jellyfish fall victim to French nuclear power plants every year",,https://www.lemonde.fr/en/environment/article/2026/06/15/nearly-six-billion-fish-crustaceans-and-jellyfish-fall-victim-to-french-nuclear-power-plants-every-year_6754503_114.html,Premium,,,
Anti-obesity centers prepare for wave of new patients as  two drugs are now covered by French health insurance,,https://www.lemonde.fr/en/france/article/2026/06/15/anti-obesity-centers-prepare-for-wave-of-new-patients-as-two-drugs-are-now-covered-by-french-health-insurance_6754507_7.html,Premium,,,
Europeans hope to put war in Ukraine back on Trump's agenda at G7 in France,,https://www.lemonde.fr/en/international/article/2026/06/15/g7-in-france-europeans-hope-to-put-war-in-ukraine-back-on-trump-s-agenda_6754488_4.html,Premium,,,
"Hungary moves to limit PMs' terms in office, blocking Orban's return",,https://www.lemonde.fr/en/international/article/2026/06/15/hungary-moves-to-limit-pms-terms-in-office-blocking-orban-s-return_6754516_4.html,,,,
Netanyahu says he will seek re-election in Israel vote,,https://www.lemonde.fr/en/international/article/2026/06/15/netanyahu-says-he-will-seek-re-election-in-israel-vote_6754522_4.html,,,,
How two families have maintained their grip on Paris food markets for 35 years,,https://www.lemonde.fr/en/politics/article/2026/06/15/how-two-families-have-maintained-their-grip-on-paris-food-markets-for-35-years_6754504_5.html,Premium,,,
When Darwin comes to town: How the urban jungle disrupts animals' natural selection,,https://www.lemonde.fr/en/science/article/2026/06/14/when-darwin-comes-to-town-how-the-urban-jungle-disrupts-animals-natural-selection_6754471_10.html,Premium,,,
The Swiss canton attracting Dubai's ultra-wealthy,"Known for its favorable tax system, Zug is attracting rich individuals looking for security and stability. The trend is also spreading to other regions of the country.",https://www.lemonde.fr/en/economy/article/2026/06/15/the-swiss-canton-attracting-dubai-s-ultra-wealthy_6754518_19.html,Premium,,,https://img.lemde.fr/2026/06/08/1/0/4000/2666/664/442/75/0/3960a22_upload-1-fw8h7uzvxa0x-gettyimages-1240324774.jpg
"At Dior, Jonathan Anderson is thinking long-term, not 'trendy'","One year after this arrival at Dior, the 41-year-old Northern Irish designer is still going at full throttle, releasing collections for Uniqlo and his own brand JW Anderson in addition to his 10 for the luxury label. His goal, he says, is to 'transform' the brand.",https://www.lemonde.fr/en/lifestyle/article/2026/06/14/at-dior-jonathan-anderson-is-thinking-long-term-not-trendy_6754450_37.html,Premium,,,https://img.lemde.fr/2026/06/08/44/35/1379/919/664/442/75/0/1246d78_ftp-1-6u0fwmahceuw-431415-3474128.jpg
"The Knicks, the soul of New York, are NBA champions after more than half a century of waiting","After a long period of anticipation and frustration, New York, where basketball is so much more than just a sport, finally celebrates, following its 94-90 triumph on Saturday in Game 5 of the NBA Finals against Victor Wembanyama's Spurs.",https://www.lemonde.fr/en/sports/article/2026/06/14/the-knicks-the-soul-of-new-york-are-nba-champions-after-more-than-half-a-century-of-waiting_6754454_9.html,Premium,,,https://img.lemde.fr/2026/06/14/0/0/2824/1882/664/442/75/0/464b464_ftp-1-qeqrz14bpddy-4b2c2a7387604924a67d46e7ffa7ecdb-0-61a8bc11d2844f88ac27eee7ea77838b.jpg
Iran war: The price of Trump's blindness,,https://www.lemonde.fr/en/opinion/article/2026/06/15/iran-war-the-price-of-trump-s-blindness_6754510_23.html,,,,
'FIFA's excesses are leading to the devaluation of the World Cup',,https://www.lemonde.fr/en/sports/article/2026/06/16/fifa-s-excesses-are-leading-to-the-devaluation-of-the-world-cup_6754532_9.html,Premium,Jérôme Latta Columnist,,
'China does not want its wealthy citizens to take their money out of the country',,https://www.lemonde.fr/en/opinion/article/2026/06/15/china-does-not-want-its-wealthy-citizens-to-take-their-money-out-of-the-country_6754509_23.html,Premium,Harold Thibault Beijing (China) correspondent,,
