Title,Subhead,Article URL,Premium,Byline,Article Type,Image URL
"In Sweden, municipalities are defying the government over voluntary return assistance for immigrants",,,Premium,,,
"In Ukraine, shotguns have become a last resort weapon against FPV drones",,,Premium,,,
"The tiger and the magpie, from Korean mythology to Netflix screens",,,Premium,,,
Thierry Reboul creates a rock music tribute for victims of the November 13 attacks: 'It had to reflect who they were',,,Premium,,,
Latvia: Public mobilization grows in support of treaty for preventing violence against women,,,Premium,,,
"After Charlie Kirk's murder, Europe's far right swears allegiance to Trump's politics",,,Premium,,,
Sanctions against Russia spark rift between US and Europe over China,,,Premium,,,
France's political instability puts Franco-German alliance to the test,,,,,,
French appeals court orders Sarkozy's release from jail,,,,,,
Thierry Reboul creates a rock music tribute for victims of the November 13 attacks: 'It had to reflect who they were',,,Premium,,,
Nicolas Sarkozy leaves jail under strict judicial supervision,,,Premium,,,
"France faces younger, less experienced and more unpredictable jihadist threat",,,Premium,,,
Afghanistan: Relentless repression continues over four years into Taliban's rule,,,,,,
Watch: Hundreds of thousands march in France against budget cuts,,,,,,
Emmys 2025: 'Adolescence' star Owen Cooper becomes youngest winner for best supporting actor,,,,,,
"From 'influence peddling' to 'corruption,' what is French Culture Minister Rachida Dati accused of?",,,,,,
'Striking down Trump's tariffs would make the rule of law prevail over the law of the jungle',,,Premium,,,
"COP30: 'Allowing temperatures to exceed 1.5°C would not only violate the Paris Agreement, but would also erode the integrity of international cooperation itself'",,,Premium,,,
The urgent need to lift sanctions against Syria,,,,,,
"The new malaise of civilization: When words, truth and reality fall apart",,,Premium,,,
"L'Arrêt by The Grey, an American bistro in Paris",,,Premium,,,
Life after terror for France's most famous prosecutor,,,Premium,,,
"What one trillion dollars means, according to Le Monde",,,Premium,,,
Marlene Dumas becomes first contemporary woman artist in Louvre's permanent collection,,,Premium,,,
"L'Arrêt by The Grey, an American bistro in Paris",,,Premium,,,
"Three historical walks in Paris, in the footsteps of the French Revolution",,,Premium,,,
The Orient Express pulls up in Paris: An opulent journey into the 1920s,,,Premium,,,
Twelve artistic happenings to catch outside Art Basel Paris,,,Premium,,,
"Wikipedia, under fire from conservatives and shaken by AI, faces growing pressure","Nearing its 25th anniversary, the online encyclopedia faces multiple challenges: accusations of 'woke' bias, threats to contributors, AI-generated content and declining readership. Despite these issues, Wikipedia remains resilient. But for how long?",https://www.lemonde.fr/en/pixels/article/2025/11/11/wikipedia-under-fire-from-conservatives-and-shaken-by-ai-faces-growing-pressure_6747330_13.html,Premium,,,https://img.lemde.fr/2025/11/07/0/0/3000/2000/400/266/75/0/606cc9a_upload-1-9jpvmge860np-wikipedia-menace-3.jpg
"Senate approves bill to end US shutdown, sending it to the House",,https://www.lemonde.fr/en/international/article/2025/11/10/senate-leader-says-a-potential-deal-is-coming-together-over-us-government-shutdown-but-no-guarantees_6747293_4.html,,,,https://img.lemde.fr/2025/11/07/0/0/4789/3193/398/265/75/0/bd28e4f_ftp-import-images-1-62cc2wktxcaq-2025-11-07t213348z-390797409-rc2wrha5qquw-rtrmadp-3-usa-shutdown.JPG
US mediator Kushner and Netanyahu discuss phase two of Gaza truce,,https://www.lemonde.fr/en/international/article/2025/11/11/us-mediator-kushner-and-netanyahu-discuss-phase-two-of-gaza-truce_6747325_4.html,,,,https://img.lemde.fr/2025/10/21/0/0/4155/2770/398/265/75/0/66993fd_ftp-import-images-1-0qo65qrqklju-2025-10-21t152950z-1422470880-rc2fghasgg0c-rtrmadp-3-israel-palestinians-vance.JPG
"In Ukraine, shotguns have become a last resort weapon against FPV drones","As the extreme lethality of FPV drones devastates the front lines, shotguns are increasingly being used among Ukrainian troops. Military leadership hopes this will save thousands of soldiers' lives and reduce the risks posed to frontline logistics.",https://www.lemonde.fr/en/international/article/2025/11/11/in-ukraine-shotguns-have-become-a-last-resort-weapon-against-fpv-drones_6747326_4.html,Premium,,,https://img.lemde.fr/2025/11/07/0/0/6000/4000/398/265/75/0/06a4f43_upload-1-7h89caarf71k-vad01688.jpg
"In Sweden, municipalities are defying the government over voluntary return assistance for immigrants","Across the Nordic country, mayors are voicing their opposition to right-wing and far-right efforts to encourage immigrants to leave. This unprecedented movement has caught the government off guard.",https://www.lemonde.fr/en/international/article/2025/11/11/in-sweden-municipalities-are-defying-the-government-over-voluntary-return-assistance-for-immigrants_6747329_4.html,Premium,,,https://img.lemde.fr/2025/11/06/1/0/8012/5341/398/265/75/0/815ec1f_upload-1-aw30qh6pjyvd-000-77p76jv.jpg
"The tiger and the magpie, from Korean mythology to Netflix screens","The success of the American animated film 'KPop Demon Hunters' has renewed South Koreans' interest in 'hojakdo,' a traditional genre that depicts tigers and magpies. Exhibitions, cultural events and culinary creations are celebrating the popularity of Derpy the tiger and Suzy the magpie, characters from the film.",https://www.lemonde.fr/en/international/article/2025/11/11/the-tiger-and-the-magpie-from-korean-mythology-to-netflix-screens_6747324_4.html,Premium,,,https://img.lemde.fr/2025/11/09/0/31/1017/678/398/265/75/0/3b90f23_upload-1-pzou9w0ekgp5-hwyb-derpy-the-blue-tiger-magpie-the-little-tiny-hat-bird-v0-kpgz8yaob3af1.jpeg
"On the Syrian Golan Heights, Israel uses the same tools of repression as in the West Bank","Israel took advantage of the fall of the Assad regime to expand the area of southern Syria it has occupied since 1967. With uprootings of olive trees, arbitrary arrests and mobile checkpoints, soldiers have imposed a similar regime to that enforced on the population of the Palestinian territory.",https://www.lemonde.fr/en/international/article/2025/11/10/on-the-syrian-golan-heights-israel-uses-the-same-tools-of-repression-as-in-the-west-bank_6747318_4.html,Premium,,,https://img.lemde.fr/2025/11/07/0/0/4723/3149/664/442/75/0/8c36748_upload-1-qv2g5r2sywo7-vdsl8479-a-11-25.jpg
"'If I get kidnapped, who will take care of my son?': Crime is thriving in Ethiopia's war-torn Amhara region",,https://www.lemonde.fr/en/le-monde-africa/article/2025/11/11/if-i-get-kidnapped-who-will-take-care-of-my-son-crime-is-thriving-in-ethiopia-s-war-torn-amhara-region_6747328_124.html,Premium,,,https://img.lemde.fr/2025/10/29/0/0/4000/2666/198/132/95/0/365d381_upload-1-xhub2aylrlky-amhara-hd-9.jpg
"Syria to join alliance against Islamic State after historic White House talks, US official says",,https://www.lemonde.fr/en/international/article/2025/11/10/trump-and-syria-s-president-hold-historic-closed-door-talks-at-the-white-house_6747321_4.html,,,,https://img.lemde.fr/2025/11/10/0/0/3000/2000/198/132/95/0/2d045c2_ftp-import-images-1-al6roqjpmotw-5402532-01-06.jpg
US to remove warnings from menopause hormone therapy,,https://www.lemonde.fr/en/international/article/2025/11/11/us-to-remove-warnings-from-menopause-hormone-therapy_6747327_4.html,,,,https://img.lemde.fr/2025/11/10/0/0/3936/2624/198/132/95/0/8be5586_ftp-import-images-1-tqlobwjfppwk-2025-11-10t164258z-575346926-rc2stha244dc-rtrmadp-3-health-usa-hormone-replacement.JPG
Thierry Reboul creates a rock music tribute for victims of the November 13 attacks: 'It had to reflect who they were',,https://www.lemonde.fr/en/international/article/2025/11/10/thierry-reboul-creates-a-rock-music-tribute-for-victims-of-the-november-13-attacks-it-had-to-reflect-who-they-were_6747322_4.html,Premium,,,https://img.lemde.fr/2025/11/04/434/0/1200/800/198/132/95/0/dc7fa0e_ftp-import-images-1-wxkkoypzcpqc-403697-3444097.jpg
Israel bill to allow death penalty for 'terrorists' passes first vote,,https://www.lemonde.fr/en/international/article/2025/11/11/israel-bill-to-allow-death-penalty-for-terrorists-passes-first-vote_6747323_4.html,,,,
Nicolas Sarkozy leaves jail under strict judicial supervision,,https://www.lemonde.fr/en/france/article/2025/11/10/nicolas-sarkozy-leaves-jail-under-strict-judicial-supervision_6747320_7.html,Premium,,,
US Supreme Court refuses to revisit same-sex marriage ruling,,https://www.lemonde.fr/en/global-issues/article/2025/11/10/us-supreme-court-refuses-to-revisit-same-sex-marriage-ruling_6747319_199.html,,,,
"L'Arrêt by The Grey, an American bistro in Paris",,https://www.lemonde.fr/en/m-le-mag/article/2025/11/10/l-arret-by-the-grey-an-american-bistro-in-paris_6747294_117.html,Premium,,,
COP30: Has the transition from fossil fuels to renewable energies truly begun?,,https://www.lemonde.fr/en/environment/article/2025/11/10/cop30-has-the-transition-from-fossil-fuels-to-renewable-energies-truly-begun_6747316_114.html,Premium,,,
"Trump pardons Giuliani, allies accused of attempting to overturn 2020 election",,https://www.lemonde.fr/en/international/article/2025/11/10/trump-pardons-giuliani-allies-accused-of-attempting-to-overturn-2020-election_6747309_4.html,,,,
Trump threatens $1 billion action as BBC apologizes for edit error,,https://www.lemonde.fr/en/international/article/2025/11/10/bbc-says-trump-threatens-to-sue-over-speech-editing-controversy_6747313_4.html,,,,
"France faces younger, less experienced and more unpredictable jihadist threat",,https://www.lemonde.fr/en/france/article/2025/11/10/france-faces-younger-less-experienced-and-more-unpredictable-jihadist-threat_6747310_7.html,Premium,,,
Hors-Studio: The French duo transforming waste into design,"In Rebecca Fezard and Elodie Michaud's workshop near Tours, these two researchers and sustainability enthusiasts transform leather scraps and oyster shells into biomaterials, which they use to make chairs that look like fossils and tables that seem to emerge from a block of stone.",https://www.lemonde.fr/en/lifestyle/article/2025/11/10/hors-studio-the-french-duo-transforming-waste-into-design_6747296_37.html,Premium,,,https://img.lemde.fr/2025/11/03/199/0/3543/2362/664/442/75/0/63f9887_upload-1-hadb9giqtdct-julie-limont-elodie-michaud-et-rebecca-fezard-laurei-ates-dialogues-2025.jpg
Is it ever a good idea to… wear your sweater draped over your shoulders?,"In fashion, as in life, it is important to know the lines you should not cross. Or else, to do so deliberately.",https://www.lemonde.fr/en/lifestyle/article/2025/11/09/is-it-ever-a-good-idea-to-wear-your-sweater-draped-over-your-shoulders_6747277_37.html,,,,https://img.lemde.fr/2025/11/03/0/0/1500/1000/664/442/75/0/26445cd_ftp-import-images-1-eq4lcykhn3kj-403477-3444048.jpg
She was hanging from the Bataclan's window. He caught her hand.,"Sébastien and Charlotte should never have met. Yet their lives have been inextricably linked since a tragic night in November 2015, when the young man saved the pregnant woman clinging to a window ledge as they both tried to escape the terrorists.",https://www.lemonde.fr/en/france/article/2025/11/09/she-was-hanging-from-the-bataclan-s-window-and-pregnant-he-caught-her-hand_6747274_7.html,Premium,,,https://img.lemde.fr/2025/11/06/535/0/6414/4276/664/442/75/0/1f3fb4f_upload-1-3dtrswiv5ko7-a-camillegharbi-le-monde-portrait-charlotte-et-sebastien-bataclan-0922.jpg
"COP30: 'Allowing temperatures to exceed 1.5°C would not only violate the Paris Agreement, but would also erode the integrity of international cooperation itself'",,https://www.lemonde.fr/en/opinion/article/2025/11/10/cop30-allowing-temperatures-to-exceed-1-5-c-would-not-only-violate-the-paris-agreement-but-would-also-erode-the-integrity-of-international-cooperation-itself_6747317_23.html,Premium,Jorge Moreira da Silva,,
The urgent need to lift sanctions against Syria,,https://www.lemonde.fr/en/opinion/article/2025/11/10/the-urgent-need-to-lift-sanctions-against-syria_6747307_23.html,,,,
COP30: Sending a message of unity and perseverance,,https://www.lemonde.fr/en/opinion/article/2025/11/07/cop30-sending-a-message-of-unity-and-perseverance_6747216_23.html,,,,
